{
  "boundaries": [
    "Status names label complete status rows, not nibble values.",
    "Actor labels are capture-local pseudonyms and cannot be joined across captures.",
    "Chronology is direction-local reconstructed stream order and does not prove causality or server policy.",
    "Both supported reverse wire encodings are retained; neither is preferred without wire evidence.",
    "No raw payload, endpoint, player name, token, timestamp, or raw actor identifier is published."
  ],
  "coverage": {
    "admitted_chat_lanes": 30,
    "admitted_lanes": 84,
    "admitted_main_lanes": 54,
    "admitted_unparsed_frame_body_bytes": 0,
    "c2s_frames": 8970,
    "c2s_subevents": 21201,
    "c2s_wrapped_subevents": 21109,
    "captures": 54,
    "compressed_frame_inflate_failures": 0,
    "decoded_target_events": 831,
    "discarded_trailing_stream_bytes": 228,
    "frame_shaped_connections": 88,
    "retransmitted_overlap_bytes": 33322,
    "s2c_frames": 10790,
    "s2c_subevents": 44663,
    "s2c_wrapped_subevents": 44556,
    "subevent_truncations": 0,
    "target_c2s_events": 0,
    "target_s2c_events": 831,
    "unique_status_row_ids": 3,
    "unique_wire_status_ids": 3,
    "wrapped_short_inner_headers": 0
  },
  "distributions": {
    "events_by_capture": {
      "combat_autoattack.pcapng": 5,
      "from_gridania_to_blackshroud.pcapng": 27,
      "gather_wood.pcapng": 2,
      "gridania_to_coerthas.pcapng": 232,
      "local_leve_complete.pcapng": 2,
      "login.pcapng": 10,
      "move_around_gridania.pcapng": 33,
      "move_out_of_room.pcapng": 53,
      "moving_around_gridania.pcapng": 281,
      "party_battle_leve.pcapng": 108,
      "return_to_inn.pcapng": 10,
      "small_talk_louisoix.pcapng": 1,
      "teleport_to_camp_nine_ivies.pcapng": 15,
      "teleport_to_camp_tranquil.pcapng": 19,
      "teleport_to_gridania.pcapng": 13,
      "war_quest_update2.pcapng": 18,
      "war_quest_update3.pcapng": 2
    },
    "events_by_lane": {
      "main": 831
    },
    "nibbles": {
      "chant_kind_1": {
        "6": 5
      },
      "chant_kind_2": {
        "10": 2,
        "7": 1,
        "8": 2
      },
      "object_bits_12_13": {
        "2": 5
      },
      "object_bits_14_15": {
        "1": 5
      },
      "object_bits_8_11": {
        "10": 2,
        "7": 1,
        "8": 2
      }
    },
    "nonzero_statuses_per_event": {
      "0": 827,
      "1": 3,
      "2": 1
    },
    "status_names": {
      "Protect": 1,
      "Resting": 2,
      "Well Fed": 2
    },
    "status_row_ids": {
      "223129": 1,
      "223263": 2,
      "223999": 2
    },
    "status_slots": {
      "1": 4,
      "2": 1
    },
    "wire_status_ids": {
      "0x5a59": 1,
      "0x5adf": 2,
      "0x5dbf": 2
    }
  },
  "exclusions": {
    "lobby_54994_connections": 2,
    "other_non_game_connections": 0,
    "tls_signature_connections": 2,
    "unexpected_application_shape": 0,
    "unexpected_subevent_size": 0
  },
  "per_capture_chronology": {
    "accept_leve.pcapng": {
      "actor_pseudonym_count": 0,
      "event_count": 0,
      "events": [],
      "exclusions": {}
    },
    "accept_local_leve.pcapng": {
      "actor_pseudonym_count": 0,
      "event_count": 0,
      "events": [],
      "exclusions": {}
    },
    "accept_quest.pcapng": {
      "actor_pseudonym_count": 0,
      "event_count": 0,
      "events": [],
      "exclusions": {}
    },
    "action_and_traits.pcapng": {
      "actor_pseudonym_count": 0,
      "event_count": 0,
      "events": [],
      "exclusions": {}
    },
    "add_str.pcapng": {
      "actor_pseudonym_count": 0,
      "event_count": 0,
      "events": [],
      "exclusions": {}
    },
    "attributes.pcapng": {
      "actor_pseudonym_count": 0,
      "event_count": 0,
      "events": [],
      "exclusions": {}
    },
    "battle_mode_passive_mode.pcapng": {
      "actor_pseudonym_count": 0,
      "event_count": 0,
      "events": [],
      "exclusions": {}
    },
    "buy_square_maple_shield.pcapng": {
      "actor_pseudonym_count": 0,
      "event_count": 0,
      "events": [],
      "exclusions": {}
    },
    "change_bodyarmor.pcapng": {
      "actor_pseudonym_count": 0,
      "event_count": 0,
      "events": [],
      "exclusions": {}
    },
    "change_helm.pcapng": {
      "actor_pseudonym_count": 0,
      "event_count": 0,
      "events": [],
      "exclusions": {}
    },
    "change_to_botanist.pcapng": {
      "actor_pseudonym_count": 0,
      "event_count": 0,
      "events": [],
      "exclusions": {}
    },
    "chat_say.pcapng": {
      "actor_pseudonym_count": 0,
      "event_count": 0,
      "events": [],
      "exclusions": {}
    },
    "chat_shout.pcapng": {
      "actor_pseudonym_count": 0,
      "event_count": 0,
      "events": [],
      "exclusions": {}
    },
    "check_room_map.pcapng": {
      "actor_pseudonym_count": 0,
      "event_count": 0,
      "events": [],
      "exclusions": {}
    },
    "checkbed.pcapng": {
      "actor_pseudonym_count": 0,
      "event_count": 0,
      "events": [],
      "exclusions": {}
    },
    "coerthas_map.pcapng": {
      "actor_pseudonym_count": 0,
      "event_count": 0,
      "events": [],
      "exclusions": {}
    },
    "combat_autoattack.pcapng": {
      "actor_pseudonym_count": 5,
      "event_count": 5,
      "events": [
        {
          "lane": "main",
          "lane_index": 0,
          "ordinal": 1,
          "source_actor": "actor-01",
          "statuses": [],
          "target_actor": "actor-02"
        },
        {
          "lane": "main",
          "lane_index": 0,
          "ordinal": 2,
          "source_actor": "actor-03",
          "statuses": [],
          "target_actor": "actor-02"
        },
        {
          "lane": "main",
          "lane_index": 0,
          "ordinal": 3,
          "source_actor": "actor-04",
          "statuses": [],
          "target_actor": "actor-02"
        },
        {
          "lane": "main",
          "lane_index": 0,
          "ordinal": 4,
          "source_actor": "actor-01",
          "statuses": [],
          "target_actor": "actor-02"
        },
        {
          "lane": "main",
          "lane_index": 0,
          "ordinal": 5,
          "source_actor": "actor-05",
          "statuses": [],
          "target_actor": "actor-02"
        }
      ],
      "exclusions": {}
    },
    "combat_skills.pcapng": {
      "actor_pseudonym_count": 0,
      "event_count": 0,
      "events": [],
      "exclusions": {}
    },
    "cutscene_book.pcapng": {
      "actor_pseudonym_count": 0,
      "event_count": 0,
      "events": [],
      "exclusions": {}
    },
    "emote_dance.pcapng": {
      "actor_pseudonym_count": 0,
      "event_count": 0,
      "events": [],
      "exclusions": {}
    },
    "emote_kneel.pcapng": {
      "actor_pseudonym_count": 0,
      "event_count": 0,
      "events": [],
      "exclusions": {}
    },
    "friendlist_search.pcapng": {
      "actor_pseudonym_count": 0,
      "event_count": 0,
      "events": [],
      "exclusions": {}
    },
    "from_gridania_to_blackshroud.pcapng": {
      "actor_pseudonym_count": 25,
      "event_count": 27,
      "events": [
        {
          "lane": "main",
          "lane_index": 0,
          "ordinal": 1,
          "source_actor": "actor-01",
          "statuses": [],
          "target_actor": "actor-02"
        },
        {
          "lane": "main",
          "lane_index": 0,
          "ordinal": 2,
          "source_actor": "actor-03",
          "statuses": [],
          "target_actor": "actor-02"
        },
        {
          "lane": "main",
          "lane_index": 0,
          "ordinal": 3,
          "source_actor": "actor-04",
          "statuses": [],
          "target_actor": "actor-02"
        },
        {
          "lane": "main",
          "lane_index": 0,
          "ordinal": 4,
          "source_actor": "actor-05",
          "statuses": [],
          "target_actor": "actor-02"
        },
        {
          "lane": "main",
          "lane_index": 0,
          "ordinal": 5,
          "source_actor": "actor-06",
          "statuses": [],
          "target_actor": "actor-02"
        },
        {
          "lane": "main",
          "lane_index": 0,
          "ordinal": 6,
          "source_actor": "actor-07",
          "statuses": [],
          "target_actor": "actor-02"
        },
        {
          "lane": "main",
          "lane_index": 0,
          "ordinal": 7,
          "source_actor": "actor-08",
          "statuses": [],
          "target_actor": "actor-02"
        },
        {
          "lane": "main",
          "lane_index": 0,
          "ordinal": 8,
          "source_actor": "actor-09",
          "statuses": [],
          "target_actor": "actor-02"
        },
        {
          "lane": "main",
          "lane_index": 0,
          "ordinal": 9,
          "source_actor": "actor-10",
          "statuses": [],
          "target_actor": "actor-02"
        },
        {
          "lane": "main",
          "lane_index": 0,
          "ordinal": 10,
          "source_actor": "actor-10",
          "statuses": [],
          "target_actor": "actor-02"
        },
        {
          "lane": "main",
          "lane_index": 0,
          "ordinal": 11,
          "source_actor": "actor-11",
          "statuses": [],
          "target_actor": "actor-02"
        },
        {
          "lane": "main",
          "lane_index": 0,
          "ordinal": 12,
          "source_actor": "actor-12",
          "statuses": [],
          "target_actor": "actor-02"
        },
        {
          "lane": "main",
          "lane_index": 0,
          "ordinal": 13,
          "source_actor": "actor-13",
          "statuses": [],
          "target_actor": "actor-02"
        },
        {
          "lane": "main",
          "lane_index": 0,
          "ordinal": 14,
          "source_actor": "actor-14",
          "statuses": [],
          "target_actor": "actor-02"
        },
        {
          "lane": "main",